{"$schema":"../../schemas/expected-normalized-v0.4.json","error_code":"ERR-SEM-DUPLICATE-HASH-COLLISION","expected_normalized_version":"0.4","notes":{"collision_claim_id":"01930007-0000-7000-8000-00000000aaaa","collision_instance_ids":["01930007-0000-7000-8000-aaaaaaaaaaaa","01930007-0000-7000-8000-bbbbbbbbbbbb"],"demonstrates":"same claim_id with different content_hash across two packages; merge-time validator MUST reject","scope":"applies only when both packages are imported into the same consumer; each package individually is valid"},"validator_verdict":"invalid"}
